Name,Category,Function,Defense Mechanism,Difficulty
Firewall-Ω,Cybersecurity System,"Analyzes all incoming traffic and instantly blocks suspicious activity.",Deep Packet Inspection (DPI),High
GhostGuard,Anti-Hack AI,Imitates and neutralizes any intruding consciousness fragments.,Mind Reflection + Learning Model,Very High
TracebackWorm,Network-Based Tracking Tool,Tracks the user's IP and redirects back to system core.,Real-Time Log Monitoring,Medium
MemoryKeeper,Consciousness Guardian,"Protects memory locks and blocks access to traumatic data blocks.",Emotional Shock Armor,High
KarmaLoop,Mental Corruption Software,Forces the user to repeat the same commands in a loop.,Mind Code Distortion,Medium
